ライブラリ名,章,節,内容
Pandas,GroupBy,pandas.core.groupby.SeriesGroupBy.fillna,"pandas.core.groupby.SeriesGroupBy.fillna#SeriesGroupBy.fillna(value=None,method=None,axis=_NoDefault.no_default,inplace=False,limit=None,downcast=_NoDefault.no_default)[source]#Fill NA/NaN values using the specified method within groups.Parameters:valuescalar, dict, Series, or DataFrameValue to use to fill holes (e.g. 0), alternately a
dict/Series/DataFrame of values specifying which value to use for
each index (for a Series) or column (for a DataFrame). Values not
in the dict/Series/DataFrame will not be filled. This value cannot
be a list. Users wanting to use thevalueargument and notmethodshould preferSeries.fillna()as this
will produce the same result and be more performant.method{{‘bfill’, ‘ffill’, None}}, default NoneMethod to use for filling holes.'ffill'will propagate
the last valid observation forward within a group.'bfill'will use next valid observation to fill the gap.Deprecated since version 2.1.0:Use obj.ffill or obj.bfill instead.axis{0 or ‘index’, 1 or ‘columns’}Unused, only for compatibility withDataFrameGroupBy.fillna().Deprecated since version 2.1.0:For axis=1, operate on the underlying object instead. Otherwise
the axis keyword is not necessary.inplacebool, default FalseBroken. Do not set to True.limitint, default NoneIf method is specified, this is the maximum number of consecutive
NaN values to forward/backward fill within a group. In other words,
if there is a gap with more than this number of consecutive NaNs,
it will only be partially filled. If method is not specified, this is the
maximum number of entries along the entire axis where NaNs will be
filled. Must be greater than 0 if not None.downcastdict, default is NoneA dict of item->dtype of what to downcast if possible,
or the string ‘infer’ which will try to downcast to an appropriate
equal type (e.g. float64 to int64 if possible).Deprecated since version 2.1.0.Returns:SeriesObject with missing values filled within groups.See alsoffillForward fill values within a group.bfillBackward fill values within a group.ExamplesFor SeriesGroupBy:>>>lst=['cat','cat','cat','mouse','mouse']>>>ser=pd.Series([1,None,None,2,None],index=lst)>>>sercat    1.0cat    NaNcat    NaNmouse  2.0mouse  NaNdtype: float64>>>ser.groupby(level=0).fillna(0,limit=1)cat    1.0cat    0.0cat    NaNmouse  2.0mouse  0.0dtype: float64"
Pandas,GroupBy,pandas.core.groupby.SeriesGroupBy.first,"pandas.core.groupby.SeriesGroupBy.first#SeriesGroupBy.first(numeric_only=False,min_count=-1)[source]#Compute the first non-null entry of each column.Parameters:numeric_onlybool, default FalseInclude only float, int, boolean columns.min_countint, default -1The required number of valid values to perform the operation. If fewer
thanmin_countnon-NA values are present the result will be NA.Returns:Series or DataFrameFirst non-null of values within each group.See alsoDataFrame.groupbyApply a function groupby to each row or column of a DataFrame.pandas.core.groupby.DataFrameGroupBy.lastCompute the last non-null entry of each column.pandas.core.groupby.DataFrameGroupBy.nthTake the nth row from each group.Examples>>>df=pd.DataFrame(dict(A=[1,1,3],B=[None,5,6],C=[1,2,3],...D=['3/11/2000','3/12/2000','3/13/2000']))>>>df['D']=pd.to_datetime(df['D'])>>>df.groupby(""A"").first()B  C          DA1  5.0  1 2000-03-113  6.0  3 2000-03-13>>>df.groupby(""A"").first(min_count=2)B    C          DA1 NaN  1.0 2000-03-113 NaN  NaN        NaT>>>df.groupby(""A"").first(numeric_only=True)B  CA1  5.0  13  6.0  3"
Pandas,GroupBy,pandas.core.groupby.SeriesGroupBy.head,"pandas.core.groupby.SeriesGroupBy.head#SeriesGroupBy.head(n=5)[source]#Return first n rows of each group.Similar to.apply(lambdax:x.head(n)), but it returns a subset of rows
from the original DataFrame with original index and order preserved
(as_indexflag is ignored).Parameters:nintIf positive: number of entries to include from start of each group.
If negative: number of entries to exclude from end of each group.Returns:Series or DataFrameSubset of original Series or DataFrame as determined by n.See alsoSeries.groupbyApply a function groupby to a Series.DataFrame.groupbyApply a function groupby to each row or column of a DataFrame.Examples>>>df=pd.DataFrame([[1,2],[1,4],[5,6]],...columns=['A','B'])>>>df.groupby('A').head(1)A  B0  1  22  5  6>>>df.groupby('A').head(-1)A  B0  1  2"
Pandas,GroupBy,pandas.core.groupby.SeriesGroupBy.last,"pandas.core.groupby.SeriesGroupBy.last#SeriesGroupBy.last(numeric_only=False,min_count=-1)[source]#Compute the last non-null entry of each column.Parameters:numeric_onlybool, default FalseInclude only float, int, boolean columns. If None, will attempt to use
everything, then use only numeric data.min_countint, default -1The required number of valid values to perform the operation. If fewer
thanmin_countnon-NA values are present the result will be NA.Returns:Series or DataFrameLast non-null of values within each group.See alsoDataFrame.groupbyApply a function groupby to each row or column of a DataFrame.pandas.core.groupby.DataFrameGroupBy.firstCompute the first non-null entry of each column.pandas.core.groupby.DataFrameGroupBy.nthTake the nth row from each group.Examples>>>df=pd.DataFrame(dict(A=[1,1,3],B=[5,None,6],C=[1,2,3]))>>>df.groupby(""A"").last()B  CA1  5.0  23  6.0  3"
Pandas,GroupBy,pandas.core.groupby.SeriesGroupBy.idxmax,"pandas.core.groupby.SeriesGroupBy.idxmax#SeriesGroupBy.idxmax(axis=_NoDefault.no_default,skipna=True)[source]#Return the row label of the maximum value.If multiple values equal the maximum, the first row label with that
value is returned.Parameters:axis{0 or ‘index’}Unused. Parameter needed for compatibility with DataFrame.skipnabool, default TrueExclude NA/null values. If the entire Series is NA, the result
will be NA.*args, **kwargsAdditional arguments and keywords have no effect but might be
accepted for compatibility with NumPy.Returns:IndexLabel of the maximum value.Raises:ValueErrorIf the Series is empty.See alsonumpy.argmaxReturn indices of the maximum values along the given axis.DataFrame.idxmaxReturn index of first occurrence of maximum over requested axis.Series.idxminReturn indexlabelof the first occurrence of minimum of values.NotesThis method is the Series version ofndarray.argmax. This method
returns the label of the maximum, whilendarray.argmaxreturns
the position. To get the position, useseries.values.argmax().Examples>>>s=pd.Series(data=[1,None,4,3,4],...index=['A','B','C','D','E'])>>>sA    1.0B    NaNC    4.0D    3.0E    4.0dtype: float64>>>s.idxmax()'C'Ifskipnais False and there is an NA value in the data,
the function returnsnan.>>>s.idxmax(skipna=False)nan"
Pandas,GroupBy,pandas.core.groupby.SeriesGroupBy.idxmin,"pandas.core.groupby.SeriesGroupBy.idxmin#SeriesGroupBy.idxmin(axis=_NoDefault.no_default,skipna=True)[source]#Return the row label of the minimum value.If multiple values equal the minimum, the first row label with that
value is returned.Parameters:axis{0 or ‘index’}Unused. Parameter needed for compatibility with DataFrame.skipnabool, default TrueExclude NA/null values. If the entire Series is NA, the result
will be NA.*args, **kwargsAdditional arguments and keywords have no effect but might be
accepted for compatibility with NumPy.Returns:IndexLabel of the minimum value.Raises:ValueErrorIf the Series is empty.See alsonumpy.argminReturn indices of the minimum values along the given axis.DataFrame.idxminReturn index of first occurrence of minimum over requested axis.Series.idxmaxReturn indexlabelof the first occurrence of maximum of values.NotesThis method is the Series version ofndarray.argmin. This method
returns the label of the minimum, whilendarray.argminreturns
the position. To get the position, useseries.values.argmin().Examples>>>s=pd.Series(data=[1,None,4,1],...index=['A','B','C','D'])>>>sA    1.0B    NaNC    4.0D    1.0dtype: float64>>>s.idxmin()'A'Ifskipnais False and there is an NA value in the data,
the function returnsnan.>>>s.idxmin(skipna=False)nan"
Pandas,GroupBy,pandas.core.groupby.SeriesGroupBy.is_monotonic_increasing,"pandas.core.groupby.SeriesGroupBy.is_monotonic_increasing#propertySeriesGroupBy.is_monotonic_increasing[source]#Return whether each group’s values are monotonically increasing.Returns:SeriesExamples>>>s=pd.Series([2,1,3,4],index=['Falcon','Falcon','Parrot','Parrot'])>>>s.groupby(level=0).is_monotonic_increasingFalcon    FalseParrot     Truedtype: bool"
Pandas,GroupBy,pandas.core.groupby.SeriesGroupBy.is_monotonic_decreasing,"pandas.core.groupby.SeriesGroupBy.is_monotonic_decreasing#propertySeriesGroupBy.is_monotonic_decreasing[source]#Return whether each group’s values are monotonically decreasing.Returns:SeriesExamples>>>s=pd.Series([2,1,3,4],index=['Falcon','Falcon','Parrot','Parrot'])>>>s.groupby(level=0).is_monotonic_decreasingFalcon     TrueParrot    Falsedtype: bool"
Pandas,GroupBy,pandas.core.groupby.SeriesGroupBy.max,"pandas.core.groupby.SeriesGroupBy.max#SeriesGroupBy.max(numeric_only=False,min_count=-1,engine=None,engine_kwargs=None)[source]#Compute max of group values.Parameters:numeric_onlybool, default FalseInclude only float, int, boolean columns.Changed in version 2.0.0:numeric_only no longer acceptsNone.min_countint, default -1The required number of valid values to perform the operation. If fewer
thanmin_countnon-NA values are present the result will be NA.enginestr, default None None'cython': Runs rolling apply through C-extensions from cython.'numba'Runs rolling apply through JIT compiled code from numba.Only available whenrawis set toTrue.None: Defaults to'cython'or globally settingcompute.use_numbaengine_kwargsdict, default None NoneFor'cython'engine, there are no acceptedengine_kwargsFor'numba'engine, the engine can acceptnopython,nogilandparalleldictionary keys. The values must either beTrueorFalse. The defaultengine_kwargsfor the'numba'engine is{'nopython':True,'nogil':False,'parallel':False}and will be
applied to both thefuncand theapplygroupby aggregation.Returns:Series or DataFrameComputed max of values within each group.ExamplesFor SeriesGroupBy:>>>lst=['a','a','b','b']>>>ser=pd.Series([1,2,3,4],index=lst)>>>sera    1a    2b    3b    4dtype: int64>>>ser.groupby(level=0).max()a    2b    4dtype: int64For DataFrameGroupBy:>>>data=[[1,8,2],[1,2,5],[2,5,8],[2,6,9]]>>>df=pd.DataFrame(data,columns=[""a"",""b"",""c""],...index=[""tiger"",""leopard"",""cheetah"",""lion""])>>>dfa  b  ctiger   1  8  2leopard   1  2  5cheetah   2  5  8lion   2  6  9>>>df.groupby(""a"").max()b  ca1   8  52   6  9"
Pandas,GroupBy,pandas.core.groupby.SeriesGroupBy.mean,"pandas.core.groupby.SeriesGroupBy.mean#SeriesGroupBy.mean(numeric_only=False,engine=None,engine_kwargs=None)[source]#Compute mean of groups, excluding missing values.Parameters:numeric_onlybool, default FalseInclude only float, int, boolean columns.Changed in version 2.0.0:numeric_only no longer acceptsNoneand defaults toFalse.enginestr, default None'cython': Runs the operation through C-extensions from cython.'numba': Runs the operation through JIT compiled code from numba.None: Defaults to'cython'or globally settingcompute.use_numbaNew in version 1.4.0.engine_kwargsdict, default NoneFor'cython'engine, there are no acceptedengine_kwargsFor'numba'engine, the engine can acceptnopython,nogilandparalleldictionary keys. The values must either beTrueorFalse. The defaultengine_kwargsfor the'numba'engine is{{'nopython':True,'nogil':False,'parallel':False}}New in version 1.4.0.Returns:pandas.Series or pandas.DataFrameSee alsoSeries.groupbyApply a function groupby to a Series.DataFrame.groupbyApply a function groupby to each row or column of a DataFrame.Examples>>>df=pd.DataFrame({'A':[1,1,2,1,2],...'B':[np.nan,2,3,4,5],...'C':[1,2,1,1,2]},columns=['A','B','C'])Groupby one column and return the mean of the remaining columns in
each group.>>>df.groupby('A').mean()B         CA1  3.0  1.3333332  4.0  1.500000Groupby two columns and return the mean of the remaining column.>>>df.groupby(['A','B']).mean()CA B1 2.0  2.04.0  1.02 3.0  1.05.0  2.0Groupby one column and return the mean of only particular column in
the group.>>>df.groupby('A')['B'].mean()A1    3.02    4.0Name: B, dtype: float64"
Pandas,GroupBy,pandas.core.groupby.SeriesGroupBy.median,"pandas.core.groupby.SeriesGroupBy.median#SeriesGroupBy.median(numeric_only=False)[source]#Compute median of groups, excluding missing values.For multiple groupings, the result index will be a MultiIndexParameters:numeric_onlybool, default FalseInclude only float, int, boolean columns.Changed in version 2.0.0:numeric_only no longer acceptsNoneand defaults to False.Returns:Series or DataFrameMedian of values within each group.ExamplesFor SeriesGroupBy:>>>lst=['a','a','a','b','b','b']>>>ser=pd.Series([7,2,8,4,3,3],index=lst)>>>sera     7a     2a     8b     4b     3b     3dtype: int64>>>ser.groupby(level=0).median()a    7.0b    3.0dtype: float64For DataFrameGroupBy:>>>data={'a':[1,3,5,7,7,8,3],'b':[1,4,8,4,4,2,1]}>>>df=pd.DataFrame(data,index=['dog','dog','dog',...'mouse','mouse','mouse','mouse'])>>>dfa  bdog    1  1dog    3  4dog    5  8mouse    7  4mouse    7  4mouse    8  2mouse    3  1>>>df.groupby(level=0).median()a    bdog    3.0  4.0mouse  7.0  3.0For Resampler:>>>ser=pd.Series([1,2,3,3,4,5],...index=pd.DatetimeIndex(['2023-01-01',...'2023-01-10',...'2023-01-15',...'2023-02-01',...'2023-02-10',...'2023-02-15']))>>>ser.resample('MS').median()2023-01-01    2.02023-02-01    4.0Freq: MS, dtype: float64"
Pandas,GroupBy,pandas.core.groupby.SeriesGroupBy.min,"pandas.core.groupby.SeriesGroupBy.min#SeriesGroupBy.min(numeric_only=False,min_count=-1,engine=None,engine_kwargs=None)[source]#Compute min of group values.Parameters:numeric_onlybool, default FalseInclude only float, int, boolean columns.Changed in version 2.0.0:numeric_only no longer acceptsNone.min_countint, default -1The required number of valid values to perform the operation. If fewer
thanmin_countnon-NA values are present the result will be NA.enginestr, default None None'cython': Runs rolling apply through C-extensions from cython.'numba'Runs rolling apply through JIT compiled code from numba.Only available whenrawis set toTrue.None: Defaults to'cython'or globally settingcompute.use_numbaengine_kwargsdict, default None NoneFor'cython'engine, there are no acceptedengine_kwargsFor'numba'engine, the engine can acceptnopython,nogilandparalleldictionary keys. The values must either beTrueorFalse. The defaultengine_kwargsfor the'numba'engine is{'nopython':True,'nogil':False,'parallel':False}and will be
applied to both thefuncand theapplygroupby aggregation.Returns:Series or DataFrameComputed min of values within each group.ExamplesFor SeriesGroupBy:>>>lst=['a','a','b','b']>>>ser=pd.Series([1,2,3,4],index=lst)>>>sera    1a    2b    3b    4dtype: int64>>>ser.groupby(level=0).min()a    1b    3dtype: int64For DataFrameGroupBy:>>>data=[[1,8,2],[1,2,5],[2,5,8],[2,6,9]]>>>df=pd.DataFrame(data,columns=[""a"",""b"",""c""],...index=[""tiger"",""leopard"",""cheetah"",""lion""])>>>dfa  b  ctiger   1  8  2leopard   1  2  5cheetah   2  5  8lion   2  6  9>>>df.groupby(""a"").min()b  ca1   2  22   5  8"
Pandas,GroupBy,pandas.core.groupby.SeriesGroupBy.ngroup,"pandas.core.groupby.SeriesGroupBy.ngroup#SeriesGroupBy.ngroup(ascending=True)[source]#Number each group from 0 to the number of groups - 1.This is the enumerative complement of cumcount. Note that the
numbers given to the groups match the order in which the groups
would be seen when iterating over the groupby object, not the
order they are first observed.Groups with missing keys (wherepd.isna()is True) will be labeled withNaNand will be skipped from the count.Parameters:ascendingbool, default TrueIf False, number in reverse, from number of group - 1 to 0.Returns:SeriesUnique numbers for each group.See alsocumcountNumber the rows in each group.Examples>>>df=pd.DataFrame({""color"":[""red"",None,""red"",""blue"",""blue"",""red""]})>>>dfcolor0    red1   None2    red3   blue4   blue5    red>>>df.groupby(""color"").ngroup()0    1.01    NaN2    1.03    0.04    0.05    1.0dtype: float64>>>df.groupby(""color"",dropna=False).ngroup()0    11    22    13    04    05    1dtype: int64>>>df.groupby(""color"",dropna=False).ngroup(ascending=False)0    11    02    13    24    25    1dtype: int64"
Pandas,GroupBy,pandas.core.groupby.SeriesGroupBy.nlargest,"pandas.core.groupby.SeriesGroupBy.nlargest#SeriesGroupBy.nlargest(n=5,keep='first')[source]#Return the largestnelements.Parameters:nint, default 5Return this many descending sorted values.keep{‘first’, ‘last’, ‘all’}, default ‘first’When there are duplicate values that cannot all fit in a
Series ofnelements:first: return the firstnoccurrences in order
of appearance.last: return the lastnoccurrences in reverse
order of appearance.all: keep all occurrences. This can result in a Series of
size larger thann.Returns:SeriesThenlargest values in the Series, sorted in decreasing order.See alsoSeries.nsmallestGet thensmallest elements.Series.sort_valuesSort Series by values.Series.headReturn the firstnrows.NotesFaster than.sort_values(ascending=False).head(n)for smallnrelative to the size of theSeriesobject.Examples>>>countries_population={""Italy"":59000000,""France"":65000000,...""Malta"":434000,""Maldives"":434000,...""Brunei"":434000,""Iceland"":337000,...""Nauru"":11300,""Tuvalu"":11300,...""Anguilla"":11300,""Montserrat"":5200}>>>s=pd.Series(countries_population)>>>sItaly       59000000France      65000000Malta         434000Maldives      434000Brunei        434000Iceland       337000Nauru          11300Tuvalu         11300Anguilla       11300Montserrat      5200dtype: int64Thenlargest elements wheren=5by default.>>>s.nlargest()France      65000000Italy       59000000Malta         434000Maldives      434000Brunei        434000dtype: int64Thenlargest elements wheren=3. Defaultkeepvalue is ‘first’
so Malta will be kept.>>>s.nlargest(3)France    65000000Italy     59000000Malta       434000dtype: int64Thenlargest elements wheren=3and keeping the last duplicates.
Brunei will be kept since it is the last with value 434000 based on
the index order.>>>s.nlargest(3,keep='last')France      65000000Italy       59000000Brunei        434000dtype: int64Thenlargest elements wheren=3with all duplicates kept. Note
that the returned Series has five elements due to the three duplicates.>>>s.nlargest(3,keep='all')France      65000000Italy       59000000Malta         434000Maldives      434000Brunei        434000dtype: int64"
Pandas,GroupBy,pandas.core.groupby.SeriesGroupBy.nsmallest,"pandas.core.groupby.SeriesGroupBy.nsmallest#SeriesGroupBy.nsmallest(n=5,keep='first')[source]#Return the smallestnelements.Parameters:nint, default 5Return this many ascending sorted values.keep{‘first’, ‘last’, ‘all’}, default ‘first’When there are duplicate values that cannot all fit in a
Series ofnelements:first: return the firstnoccurrences in order
of appearance.last: return the lastnoccurrences in reverse
order of appearance.all: keep all occurrences. This can result in a Series of
size larger thann.Returns:SeriesThensmallest values in the Series, sorted in increasing order.See alsoSeries.nlargestGet thenlargest elements.Series.sort_valuesSort Series by values.Series.headReturn the firstnrows.NotesFaster than.sort_values().head(n)for smallnrelative to
the size of theSeriesobject.Examples>>>countries_population={""Italy"":59000000,""France"":65000000,...""Brunei"":434000,""Malta"":434000,...""Maldives"":434000,""Iceland"":337000,...""Nauru"":11300,""Tuvalu"":11300,...""Anguilla"":11300,""Montserrat"":5200}>>>s=pd.Series(countries_population)>>>sItaly       59000000France      65000000Brunei        434000Malta         434000Maldives      434000Iceland       337000Nauru          11300Tuvalu         11300Anguilla       11300Montserrat      5200dtype: int64Thensmallest elements wheren=5by default.>>>s.nsmallest()Montserrat    5200Nauru        11300Tuvalu       11300Anguilla     11300Iceland     337000dtype: int64Thensmallest elements wheren=3. Defaultkeepvalue is
‘first’ so Nauru and Tuvalu will be kept.>>>s.nsmallest(3)Montserrat   5200Nauru       11300Tuvalu      11300dtype: int64Thensmallest elements wheren=3and keeping the last
duplicates. Anguilla and Tuvalu will be kept since they are the last
with value 11300 based on the index order.>>>s.nsmallest(3,keep='last')Montserrat   5200Anguilla    11300Tuvalu      11300dtype: int64Thensmallest elements wheren=3with all duplicates kept. Note
that the returned Series has four elements due to the three duplicates.>>>s.nsmallest(3,keep='all')Montserrat   5200Nauru       11300Tuvalu      11300Anguilla    11300dtype: int64"
Pandas,GroupBy,pandas.core.groupby.SeriesGroupBy.nth,"pandas.core.groupby.SeriesGroupBy.nth#propertySeriesGroupBy.nth[source]#Take the nth row from each group if n is an int, otherwise a subset of rows.Can be either a call or an index. dropna is not available with index notation.
Index notation accepts a comma separated list of integers and slices.If dropna, will take the nth non-null row, dropna is either
‘all’ or ‘any’; this is equivalent to calling dropna(how=dropna)
before the groupby.Parameters:nint, slice or list of ints and slicesA single nth value for the row or a list of nth values or slices.Changed in version 1.4.0:Added slice and lists containing slices.
Added index notation.dropna{‘any’, ‘all’, None}, default NoneApply the specified dropna operation before counting which row is
the nth row. Only supported if n is an int.Returns:Series or DataFrameN-th value within each group.See alsoSeries.groupbyApply a function groupby to a Series.DataFrame.groupbyApply a function groupby to each row or column of a DataFrame.Examples>>>df=pd.DataFrame({'A':[1,1,2,1,2],...'B':[np.nan,2,3,4,5]},columns=['A','B'])>>>g=df.groupby('A')>>>g.nth(0)A   B0  1 NaN2  2 3.0>>>g.nth(1)A   B1  1 2.04  2 5.0>>>g.nth(-1)A   B3  1 4.04  2 5.0>>>g.nth([0,1])A   B0  1 NaN1  1 2.02  2 3.04  2 5.0>>>g.nth(slice(None,-1))A   B0  1 NaN1  1 2.02  2 3.0Index notation may also be used>>>g.nth[0,1]A   B0  1 NaN1  1 2.02  2 3.04  2 5.0>>>g.nth[:-1]A   B0  1 NaN1  1 2.02  2 3.0Specifyingdropnaallows ignoringNaNvalues>>>g.nth(0,dropna='any')A   B1  1 2.02  2 3.0When the specifiednis larger than any of the groups, an
empty DataFrame is returned>>>g.nth(3,dropna='any')Empty DataFrameColumns: [A, B]Index: []"
Pandas,GroupBy,pandas.core.groupby.SeriesGroupBy.nunique,"pandas.core.groupby.SeriesGroupBy.nunique#SeriesGroupBy.nunique(dropna=True)[source]#Return number of unique elements in the group.Returns:SeriesNumber of unique values within each group.ExamplesFor SeriesGroupby:>>>lst=['a','a','b','b']>>>ser=pd.Series([1,2,3,3],index=lst)>>>sera    1a    2b    3b    3dtype: int64>>>ser.groupby(level=0).nunique()a    2b    1dtype: int64For Resampler:>>>ser=pd.Series([1,2,3,3],index=pd.DatetimeIndex(...['2023-01-01','2023-01-15','2023-02-01','2023-02-15']))>>>ser2023-01-01    12023-01-15    22023-02-01    32023-02-15    3dtype: int64>>>ser.resample('MS').nunique()2023-01-01    22023-02-01    1Freq: MS, dtype: int64"
Pandas,GroupBy,pandas.core.groupby.SeriesGroupBy.unique,"pandas.core.groupby.SeriesGroupBy.unique#SeriesGroupBy.unique()[source]#Return unique values for each group.It returns unique values for each of the grouped values. Returned in
order of appearance. Hash table-based unique, therefore does NOT sort.Returns:SeriesUnique values for each of the grouped values.See alsoSeries.uniqueReturn unique values of Series object.Examples>>>df=pd.DataFrame([('Chihuahua','dog',6.1),...('Beagle','dog',15.2),...('Chihuahua','dog',6.9),...('Persian','cat',9.2),...('Chihuahua','dog',7),...('Persian','cat',8.8)],...columns=['breed','animal','height_in'])>>>dfbreed     animal   height_in0  Chihuahua        dog         6.11     Beagle        dog        15.22  Chihuahua        dog         6.93    Persian        cat         9.24  Chihuahua        dog         7.05    Persian        cat         8.8>>>ser=df.groupby('animal')['breed'].unique()>>>seranimalcat              [Persian]dog    [Chihuahua, Beagle]Name: breed, dtype: object"
Pandas,GroupBy,pandas.core.groupby.SeriesGroupBy.ohlc,"pandas.core.groupby.SeriesGroupBy.ohlc#SeriesGroupBy.ohlc()[source]#Compute open, high, low and close values of a group, excluding missing values.For multiple groupings, the result index will be a MultiIndexReturns:DataFrameOpen, high, low and close values within each group.ExamplesFor SeriesGroupBy:>>>lst=['SPX','CAC','SPX','CAC','SPX','CAC','SPX','CAC',]>>>ser=pd.Series([3.4,9.0,7.2,5.2,8.8,9.4,0.1,0.5],index=lst)>>>serSPX     3.4CAC     9.0SPX     7.2CAC     5.2SPX     8.8CAC     9.4SPX     0.1CAC     0.5dtype: float64>>>ser.groupby(level=0).ohlc()open  high  low  closeCAC   9.0   9.4  0.5    0.5SPX   3.4   8.8  0.1    0.1For DataFrameGroupBy:>>>data={2022:[1.2,2.3,8.9,4.5,4.4,3,2,1],...2023:[3.4,9.0,7.2,5.2,8.8,9.4,8.2,1.0]}>>>df=pd.DataFrame(data,index=['SPX','CAC','SPX','CAC',...'SPX','CAC','SPX','CAC'])>>>df2022  2023SPX   1.2   3.4CAC   2.3   9.0SPX   8.9   7.2CAC   4.5   5.2SPX   4.4   8.8CAC   3.0   9.4SPX   2.0   8.2CAC   1.0   1.0>>>df.groupby(level=0).ohlc()2022                 2023open high  low close open high  low closeCAC  2.3  4.5  1.0   1.0  9.0  9.4  1.0   1.0SPX  1.2  8.9  1.2   2.0  3.4  8.8  3.4   8.2For Resampler:>>>ser=pd.Series([1,3,2,4,3,5],...index=pd.DatetimeIndex(['2023-01-01',...'2023-01-10',...'2023-01-15',...'2023-02-01',...'2023-02-10',...'2023-02-15']))>>>ser.resample('MS').ohlc()open  high  low  close2023-01-01     1     3    1      22023-02-01     4     5    3      5"
