ライブラリ名,章,節,内容
Pandas,GroupBy,pandas.core.groupby.DataFrameGroupBy.__iter__,"pandas.core.groupby.DataFrameGroupBy.__iter__#DataFrameGroupBy.__iter__()[source]#Groupby iterator.Returns:Generator yielding sequence of (name, subsetted object)for each groupExamplesFor SeriesGroupBy:>>>lst=['a','a','b']>>>ser=pd.Series([1,2,3],index=lst)>>>sera    1a    2b    3dtype: int64>>>forx,yinser.groupby(level=0):...print(f'{x}\n{y}\n')aa    1a    2dtype: int64bb    3dtype: int64For DataFrameGroupBy:>>>data=[[1,2,3],[1,5,6],[7,8,9]]>>>df=pd.DataFrame(data,columns=[""a"",""b"",""c""])>>>dfa  b  c0  1  2  31  1  5  62  7  8  9>>>forx,yindf.groupby(by=[""a""]):...print(f'{x}\n{y}\n')(1,)a  b  c0  1  2  31  1  5  6(7,)a  b  c2  7  8  9For Resampler:>>>ser=pd.Series([1,2,3,4],index=pd.DatetimeIndex(...['2023-01-01','2023-01-15','2023-02-01','2023-02-15']))>>>ser2023-01-01    12023-01-15    22023-02-01    32023-02-15    4dtype: int64>>>forx,yinser.resample('MS'):...print(f'{x}\n{y}\n')2023-01-01 00:00:002023-01-01    12023-01-15    2dtype: int642023-02-01 00:00:002023-02-01    32023-02-15    4dtype: int64"
Pandas,GroupBy,pandas.core.groupby.SeriesGroupBy.__iter__,"pandas.core.groupby.SeriesGroupBy.__iter__#SeriesGroupBy.__iter__()[source]#Groupby iterator.Returns:Generator yielding sequence of (name, subsetted object)for each groupExamplesFor SeriesGroupBy:>>>lst=['a','a','b']>>>ser=pd.Series([1,2,3],index=lst)>>>sera    1a    2b    3dtype: int64>>>forx,yinser.groupby(level=0):...print(f'{x}\n{y}\n')aa    1a    2dtype: int64bb    3dtype: int64For DataFrameGroupBy:>>>data=[[1,2,3],[1,5,6],[7,8,9]]>>>df=pd.DataFrame(data,columns=[""a"",""b"",""c""])>>>dfa  b  c0  1  2  31  1  5  62  7  8  9>>>forx,yindf.groupby(by=[""a""]):...print(f'{x}\n{y}\n')(1,)a  b  c0  1  2  31  1  5  6(7,)a  b  c2  7  8  9For Resampler:>>>ser=pd.Series([1,2,3,4],index=pd.DatetimeIndex(...['2023-01-01','2023-01-15','2023-02-01','2023-02-15']))>>>ser2023-01-01    12023-01-15    22023-02-01    32023-02-15    4dtype: int64>>>forx,yinser.resample('MS'):...print(f'{x}\n{y}\n')2023-01-01 00:00:002023-01-01    12023-01-15    2dtype: int642023-02-01 00:00:002023-02-01    32023-02-15    4dtype: int64"
Pandas,GroupBy,pandas.core.groupby.DataFrameGroupBy.groups,"pandas.core.groupby.DataFrameGroupBy.groups#propertyDataFrameGroupBy.groups[source]#Dict {group name -> group labels}.ExamplesFor SeriesGroupBy:>>>lst=['a','a','b']>>>ser=pd.Series([1,2,3],index=lst)>>>sera    1a    2b    3dtype: int64>>>ser.groupby(level=0).groups{'a': ['a', 'a'], 'b': ['b']}For DataFrameGroupBy:>>>data=[[1,2,3],[1,5,6],[7,8,9]]>>>df=pd.DataFrame(data,columns=[""a"",""b"",""c""])>>>dfa  b  c0  1  2  31  1  5  62  7  8  9>>>df.groupby(by=[""a""]).groups{1: [0, 1], 7: [2]}For Resampler:>>>ser=pd.Series([1,2,3,4],index=pd.DatetimeIndex(...['2023-01-01','2023-01-15','2023-02-01','2023-02-15']))>>>ser2023-01-01    12023-01-15    22023-02-01    32023-02-15    4dtype: int64>>>ser.resample('MS').groups{Timestamp('2023-01-01 00:00:00'): 2, Timestamp('2023-02-01 00:00:00'): 4}"
Pandas,GroupBy,pandas.core.groupby.SeriesGroupBy.groups,"pandas.core.groupby.SeriesGroupBy.groups#propertySeriesGroupBy.groups[source]#Dict {group name -> group labels}.ExamplesFor SeriesGroupBy:>>>lst=['a','a','b']>>>ser=pd.Series([1,2,3],index=lst)>>>sera    1a    2b    3dtype: int64>>>ser.groupby(level=0).groups{'a': ['a', 'a'], 'b': ['b']}For DataFrameGroupBy:>>>data=[[1,2,3],[1,5,6],[7,8,9]]>>>df=pd.DataFrame(data,columns=[""a"",""b"",""c""])>>>dfa  b  c0  1  2  31  1  5  62  7  8  9>>>df.groupby(by=[""a""]).groups{1: [0, 1], 7: [2]}For Resampler:>>>ser=pd.Series([1,2,3,4],index=pd.DatetimeIndex(...['2023-01-01','2023-01-15','2023-02-01','2023-02-15']))>>>ser2023-01-01    12023-01-15    22023-02-01    32023-02-15    4dtype: int64>>>ser.resample('MS').groups{Timestamp('2023-01-01 00:00:00'): 2, Timestamp('2023-02-01 00:00:00'): 4}"
Pandas,GroupBy,pandas.core.groupby.DataFrameGroupBy.indices,"pandas.core.groupby.DataFrameGroupBy.indices#propertyDataFrameGroupBy.indices[source]#Dict {group name -> group indices}.ExamplesFor SeriesGroupBy:>>>lst=['a','a','b']>>>ser=pd.Series([1,2,3],index=lst)>>>sera    1a    2b    3dtype: int64>>>ser.groupby(level=0).indices{'a': array([0, 1]), 'b': array([2])}For DataFrameGroupBy:>>>data=[[1,2,3],[1,5,6],[7,8,9]]>>>df=pd.DataFrame(data,columns=[""a"",""b"",""c""],...index=[""owl"",""toucan"",""eagle""])>>>dfa  b  cowl     1  2  3toucan  1  5  6eagle   7  8  9>>>df.groupby(by=[""a""]).indices{1: array([0, 1]), 7: array([2])}For Resampler:>>>ser=pd.Series([1,2,3,4],index=pd.DatetimeIndex(...['2023-01-01','2023-01-15','2023-02-01','2023-02-15']))>>>ser2023-01-01    12023-01-15    22023-02-01    32023-02-15    4dtype: int64>>>ser.resample('MS').indicesdefaultdict(<class 'list'>, {Timestamp('2023-01-01 00:00:00'): [0, 1],Timestamp('2023-02-01 00:00:00'): [2, 3]})"
Pandas,GroupBy,pandas.core.groupby.SeriesGroupBy.indices,"pandas.core.groupby.SeriesGroupBy.indices#propertySeriesGroupBy.indices[source]#Dict {group name -> group indices}.ExamplesFor SeriesGroupBy:>>>lst=['a','a','b']>>>ser=pd.Series([1,2,3],index=lst)>>>sera    1a    2b    3dtype: int64>>>ser.groupby(level=0).indices{'a': array([0, 1]), 'b': array([2])}For DataFrameGroupBy:>>>data=[[1,2,3],[1,5,6],[7,8,9]]>>>df=pd.DataFrame(data,columns=[""a"",""b"",""c""],...index=[""owl"",""toucan"",""eagle""])>>>dfa  b  cowl     1  2  3toucan  1  5  6eagle   7  8  9>>>df.groupby(by=[""a""]).indices{1: array([0, 1]), 7: array([2])}For Resampler:>>>ser=pd.Series([1,2,3,4],index=pd.DatetimeIndex(...['2023-01-01','2023-01-15','2023-02-01','2023-02-15']))>>>ser2023-01-01    12023-01-15    22023-02-01    32023-02-15    4dtype: int64>>>ser.resample('MS').indicesdefaultdict(<class 'list'>, {Timestamp('2023-01-01 00:00:00'): [0, 1],Timestamp('2023-02-01 00:00:00'): [2, 3]})"
Pandas,GroupBy,pandas.core.groupby.DataFrameGroupBy.get_group,"pandas.core.groupby.DataFrameGroupBy.get_group#DataFrameGroupBy.get_group(name,obj=None)[source]#Construct DataFrame from group with provided name.Parameters:nameobjectThe name of the group to get as a DataFrame.objDataFrame, default NoneThe DataFrame to take the DataFrame out of. If
it is None, the object groupby was called on will
be used.Deprecated since version 2.1.0:The obj is deprecated and will be removed in a future version.
Dodf.iloc[gb.indices.get(name)]instead ofgb.get_group(name,obj=df).Returns:same type as objExamplesFor SeriesGroupBy:>>>lst=['a','a','b']>>>ser=pd.Series([1,2,3],index=lst)>>>sera    1a    2b    3dtype: int64>>>ser.groupby(level=0).get_group(""a"")a    1a    2dtype: int64For DataFrameGroupBy:>>>data=[[1,2,3],[1,5,6],[7,8,9]]>>>df=pd.DataFrame(data,columns=[""a"",""b"",""c""],...index=[""owl"",""toucan"",""eagle""])>>>dfa  b  cowl     1  2  3toucan  1  5  6eagle   7  8  9>>>df.groupby(by=[""a""]).get_group(1)a  b  cowl     1  2  3toucan  1  5  6For Resampler:>>>ser=pd.Series([1,2,3,4],index=pd.DatetimeIndex(...['2023-01-01','2023-01-15','2023-02-01','2023-02-15']))>>>ser2023-01-01    12023-01-15    22023-02-01    32023-02-15    4dtype: int64>>>ser.resample('MS').get_group('2023-01-01')2023-01-01    12023-01-15    2dtype: int64"
Pandas,GroupBy,pandas.core.groupby.SeriesGroupBy.get_group,"pandas.core.groupby.SeriesGroupBy.get_group#SeriesGroupBy.get_group(name,obj=None)[source]#Construct DataFrame from group with provided name.Parameters:nameobjectThe name of the group to get as a DataFrame.objDataFrame, default NoneThe DataFrame to take the DataFrame out of. If
it is None, the object groupby was called on will
be used.Deprecated since version 2.1.0:The obj is deprecated and will be removed in a future version.
Dodf.iloc[gb.indices.get(name)]instead ofgb.get_group(name,obj=df).Returns:same type as objExamplesFor SeriesGroupBy:>>>lst=['a','a','b']>>>ser=pd.Series([1,2,3],index=lst)>>>sera    1a    2b    3dtype: int64>>>ser.groupby(level=0).get_group(""a"")a    1a    2dtype: int64For DataFrameGroupBy:>>>data=[[1,2,3],[1,5,6],[7,8,9]]>>>df=pd.DataFrame(data,columns=[""a"",""b"",""c""],...index=[""owl"",""toucan"",""eagle""])>>>dfa  b  cowl     1  2  3toucan  1  5  6eagle   7  8  9>>>df.groupby(by=[""a""]).get_group(1)a  b  cowl     1  2  3toucan  1  5  6For Resampler:>>>ser=pd.Series([1,2,3,4],index=pd.DatetimeIndex(...['2023-01-01','2023-01-15','2023-02-01','2023-02-15']))>>>ser2023-01-01    12023-01-15    22023-02-01    32023-02-15    4dtype: int64>>>ser.resample('MS').get_group('2023-01-01')2023-01-01    12023-01-15    2dtype: int64"
Pandas,GroupBy,pandas.Grouper,"pandas.Grouper#classpandas.Grouper(*args,**kwargs)[source]#A Grouper allows the user to specify a groupby instruction for an object.This specification will select a column via the key parameter, or if the
level and/or axis parameters are given, a level of the index of the target
object.Ifaxisand/orlevelare passed as keywords to bothGrouperandgroupby, the values passed toGroupertake precedence.Parameters:keystr, defaults to NoneGroupby key, which selects the grouping column of the target.levelname/number, defaults to NoneThe level for the target index.freqstr / frequency object, defaults to NoneThis will groupby the specified frequency if the target selection
(via key or level) is a datetime-like object. For full specification
of available frequencies, please seehere.axisstr, int, defaults to 0Number/name of the axis.sortbool, default to FalseWhether to sort the resulting labels.closed{‘left’ or ‘right’}Closed end of interval. Only whenfreqparameter is passed.label{‘left’ or ‘right’}Interval boundary to use for labeling.
Only whenfreqparameter is passed.convention{‘start’, ‘end’, ‘e’, ‘s’}If grouper is PeriodIndex andfreqparameter is passed.originTimestamp or str, default ‘start_day’The timestamp on which to adjust the grouping. The timezone of origin must
match the timezone of the index.
If string, must be one of the following:‘epoch’:originis 1970-01-01‘start’:originis the first value of the timeseries‘start_day’:originis the first day at midnight of the timeseries‘end’:originis the last value of the timeseries‘end_day’:originis the ceiling midnight of the last dayNew in version 1.3.0.offsetTimedelta or str, default is NoneAn offset timedelta added to the origin.dropnabool, default TrueIf True, and if group keys contain NA values, NA values together with
row/column will be dropped. If False, NA values will also be treated as
the key in groups.New in version 1.2.0.Returns:Grouper or pandas.api.typing.TimeGrouperA TimeGrouper is returned iffreqis notNone. Otherwise, a Grouper
is returned.Examplesdf.groupby(pd.Grouper(key=""Animal""))is equivalent todf.groupby('Animal')>>>df=pd.DataFrame(...{...""Animal"":[""Falcon"",""Parrot"",""Falcon"",""Falcon"",""Parrot""],...""Speed"":[100,5,200,300,15],...}...)>>>dfAnimal  Speed0  Falcon    1001  Parrot      52  Falcon    2003  Falcon    3004  Parrot     15>>>df.groupby(pd.Grouper(key=""Animal"")).mean()SpeedAnimalFalcon  200.0Parrot   10.0Specify a resample operation on the column ‘Publish date’>>>df=pd.DataFrame(...{...""Publish date"":[...pd.Timestamp(""2000-01-02""),...pd.Timestamp(""2000-01-02""),...pd.Timestamp(""2000-01-09""),...pd.Timestamp(""2000-01-16"")...],...""ID"":[0,1,2,3],...""Price"":[10,20,30,40]...}...)>>>dfPublish date  ID  Price0   2000-01-02   0     101   2000-01-02   1     202   2000-01-09   2     303   2000-01-16   3     40>>>df.groupby(pd.Grouper(key=""Publish date"",freq=""1W"")).mean()ID  PricePublish date2000-01-02    0.5   15.02000-01-09    2.0   30.02000-01-16    3.0   40.0If you want to adjust the start of the bins based on a fixed timestamp:>>>start,end='2000-10-01 23:30:00','2000-10-02 00:30:00'>>>rng=pd.date_range(start,end,freq='7min')>>>ts=pd.Series(np.arange(len(rng))*3,index=rng)>>>ts2000-10-01 23:30:00     02000-10-01 23:37:00     32000-10-01 23:44:00     62000-10-01 23:51:00     92000-10-01 23:58:00    122000-10-02 00:05:00    152000-10-02 00:12:00    182000-10-02 00:19:00    212000-10-02 00:26:00    24Freq: 7T, dtype: int64>>>ts.groupby(pd.Grouper(freq='17min')).sum()2000-10-01 23:14:00     02000-10-01 23:31:00     92000-10-01 23:48:00    212000-10-02 00:05:00    542000-10-02 00:22:00    24Freq: 17T, dtype: int64>>>ts.groupby(pd.Grouper(freq='17min',origin='epoch')).sum()2000-10-01 23:18:00     02000-10-01 23:35:00    182000-10-01 23:52:00    272000-10-02 00:09:00    392000-10-02 00:26:00    24Freq: 17T, dtype: int64>>>ts.groupby(pd.Grouper(freq='17min',origin='2000-01-01')).sum()2000-10-01 23:24:00     32000-10-01 23:41:00    152000-10-01 23:58:00    452000-10-02 00:15:00    45Freq: 17T, dtype: int64If you want to adjust the start of the bins with anoffsetTimedelta, the two
following lines are equivalent:>>>ts.groupby(pd.Grouper(freq='17min',origin='start')).sum()2000-10-01 23:30:00     92000-10-01 23:47:00    212000-10-02 00:04:00    542000-10-02 00:21:00    24Freq: 17T, dtype: int64>>>ts.groupby(pd.Grouper(freq='17min',offset='23h30min')).sum()2000-10-01 23:30:00     92000-10-01 23:47:00    212000-10-02 00:04:00    542000-10-02 00:21:00    24Freq: 17T, dtype: int64To replace the use of the deprecatedbaseargument, you can now useoffset,
in this example it is equivalent to havebase=2:>>>ts.groupby(pd.Grouper(freq='17min',offset='2min')).sum()2000-10-01 23:16:00     02000-10-01 23:33:00     92000-10-01 23:50:00    362000-10-02 00:07:00    392000-10-02 00:24:00    24Freq: 17T, dtype: int64Attributesaxgroupergroupsindexerobj"
Pandas,GroupBy,pandas.NamedAgg,"pandas.NamedAgg#classpandas.NamedAgg(column,aggfunc)[source]#Helper for column specific aggregation with control over output column names.Subclass of typing.NamedTuple.Parameters:columnHashableColumn label in the DataFrame to apply aggfunc.aggfuncfunction or strFunction to apply to the provided column. If string, the name of a built-in
pandas function.Examples>>>df=pd.DataFrame({""key"":[1,1,2],""a"":[-1,0,1],1:[10,11,12]})>>>agg_a=pd.NamedAgg(column=""a"",aggfunc=""min"")>>>agg_1=pd.NamedAgg(column=1,aggfunc=lambdax:np.mean(x))>>>df.groupby(""key"").agg(result_a=agg_a,result_1=agg_1)result_a  result_1key1          -1      10.52           1      12.0AttributesaggfuncAlias for field number 1columnAlias for field number 0Methodscount(value, /)Return number of occurrences of value.index(value[, start, stop])Return first index of value."
Pandas,GroupBy,pandas.core.groupby.SeriesGroupBy.apply,"pandas.core.groupby.SeriesGroupBy.apply#SeriesGroupBy.apply(func,*args,**kwargs)[source]#Apply functionfuncgroup-wise and combine the results together.The function passed toapplymust take a series as its first
argument and return a DataFrame, Series or scalar.applywill
then take care of combining the results back together into a single
dataframe or series.applyis therefore a highly flexible
grouping method.Whileapplyis a very flexible method, its downside is that
using it can be quite a bit slower than using more specific methods
likeaggortransform. Pandas offers a wide range of method that will
be much faster than usingapplyfor their specific purposes, so try to
use them before reaching forapply.Parameters:funccallableA callable that takes a series as its first argument, and
returns a dataframe, a series or a scalar. In addition the
callable may take positional and keyword arguments.args, kwargstuple and dictOptional positional and keyword arguments to pass tofunc.Returns:Series or DataFrameSee alsopipeApply function to the full GroupBy object instead of to each group.aggregateApply aggregate function to the GroupBy object.transformApply function column-by-column to the GroupBy object.Series.applyApply a function to a Series.DataFrame.applyApply a function to each row or column of a DataFrame.NotesChanged in version 1.3.0:The resulting dtype will reflect the return value of the passedfunc,
see the examples below.Functions that mutate the passed object can produce unexpected
behavior or errors and are not supported. SeeMutating with User Defined Function (UDF) methodsfor more details.Examples>>>s=pd.Series([0,1,2],index='a a b'.split())>>>g1=s.groupby(s.index,group_keys=False)>>>g2=s.groupby(s.index,group_keys=True)Fromsabove we can see thatghas two groups,aandb.
Notice thatg1haveg2have two groups,aandb, and only
differ in theirgroup_keysargument. Callingapplyin various ways,
we can get different grouping results:Example 1: The function passed toapplytakes a Series as
its argument and returns a Series.applycombines the result for
each group together into a new Series.Changed in version 1.3.0:The resulting dtype will reflect the return value of the passedfunc.>>>g1.apply(lambdax:x*2ifx.name=='a'elsex/2)a    0.0a    2.0b    1.0dtype: float64In the above, the groups are not part of the index. We can have them included
by usingg2wheregroup_keys=True:>>>g2.apply(lambdax:x*2ifx.name=='a'elsex/2)a  a    0.0a    2.0b  b    1.0dtype: float64Example 2: The function passed toapplytakes a Series as
its argument and returns a scalar.applycombines the result for
each group together into a Series, including setting the index as
appropriate:>>>g1.apply(lambdax:x.max()-x.min())a    1b    0dtype: int64Thegroup_keysargument has no effect here because the result is not
like-indexed (i.e.a transform) when compared
to the input.>>>g2.apply(lambdax:x.max()-x.min())a    1b    0dtype: int64"
Pandas,GroupBy,pandas.core.groupby.DataFrameGroupBy.apply,"pandas.core.groupby.DataFrameGroupBy.apply#DataFrameGroupBy.apply(func,*args,**kwargs)[source]#Apply functionfuncgroup-wise and combine the results together.The function passed toapplymust take a dataframe as its first
argument and return a DataFrame, Series or scalar.applywill
then take care of combining the results back together into a single
dataframe or series.applyis therefore a highly flexible
grouping method.Whileapplyis a very flexible method, its downside is that
using it can be quite a bit slower than using more specific methods
likeaggortransform. Pandas offers a wide range of method that will
be much faster than usingapplyfor their specific purposes, so try to
use them before reaching forapply.Parameters:funccallableA callable that takes a dataframe as its first argument, and
returns a dataframe, a series or a scalar. In addition the
callable may take positional and keyword arguments.args, kwargstuple and dictOptional positional and keyword arguments to pass tofunc.Returns:Series or DataFrameSee alsopipeApply function to the full GroupBy object instead of to each group.aggregateApply aggregate function to the GroupBy object.transformApply function column-by-column to the GroupBy object.Series.applyApply a function to a Series.DataFrame.applyApply a function to each row or column of a DataFrame.NotesChanged in version 1.3.0:The resulting dtype will reflect the return value of the passedfunc,
see the examples below.Functions that mutate the passed object can produce unexpected
behavior or errors and are not supported. SeeMutating with User Defined Function (UDF) methodsfor more details.Examples>>>df=pd.DataFrame({'A':'a a b'.split(),...'B':[1,2,3],...'C':[4,6,5]})>>>g1=df.groupby('A',group_keys=False)>>>g2=df.groupby('A',group_keys=True)Notice thatg1andg2have two groups,aandb, and only
differ in theirgroup_keysargument. Callingapplyin various ways,
we can get different grouping results:Example 1: below the function passed toapplytakes a DataFrame as
its argument and returns a DataFrame.applycombines the result for
each group together into a new DataFrame:>>>g1[['B','C']].apply(lambdax:x/x.sum())B    C0  0.333333  0.41  0.666667  0.62  1.000000  1.0In the above, the groups are not part of the index. We can have them included
by usingg2wheregroup_keys=True:>>>g2[['B','C']].apply(lambdax:x/x.sum())B    CAa 0  0.333333  0.41  0.666667  0.6b 2  1.000000  1.0Example 2: The function passed toapplytakes a DataFrame as
its argument and returns a Series.applycombines the result for
each group together into a new DataFrame.Changed in version 1.3.0:The resulting dtype will reflect the return value of the passedfunc.>>>g1[['B','C']].apply(lambdax:x.astype(float).max()-x.min())B    CAa  1.0  2.0b  0.0  0.0>>>g2[['B','C']].apply(lambdax:x.astype(float).max()-x.min())B    CAa  1.0  2.0b  0.0  0.0Thegroup_keysargument has no effect here because the result is not
like-indexed (i.e.a transform) when compared
to the input.Example 3: The function passed toapplytakes a DataFrame as
its argument and returns a scalar.applycombines the result for
each group together into a Series, including setting the index as
appropriate:>>>g1.apply(lambdax:x.C.max()-x.B.min())Aa    5b    2dtype: int64"
Pandas,GroupBy,pandas.core.groupby.SeriesGroupBy.agg,"pandas.core.groupby.SeriesGroupBy.agg#SeriesGroupBy.agg(func=None,*args,engine=None,engine_kwargs=None,**kwargs)[source]#Aggregate using one or more operations over the specified axis.Parameters:funcfunction, str, list, dict or NoneFunction to use for aggregating the data. If a function, must either
work when passed a Series or when passed to Series.apply.Accepted combinations are:functionstring function namelist of functions and/or function names, e.g.[np.sum,'mean']None, in which case**kwargsare used with Named Aggregation. Here the
output has one column for each element in**kwargs. The name of the
column is keyword, whereas the value determines the aggregation used to compute
the values in the column.Can also accept a Numba JIT function withengine='numba'specified. Only passing a single function is supported
with this engine.If the'numba'engine is chosen, the function must be
a user defined function withvaluesandindexas the
first and second arguments respectively in the function signature.
Each group’s index will be passed to the user defined function
and optionally available for use.Deprecated since version 2.1.0:Passing a dictionary is deprecated and will raise in a future version
of pandas. Pass a list of aggregations instead.*argsPositional arguments to pass to func.enginestr, default None'cython': Runs the function through C-extensions from cython.'numba': Runs the function through JIT compiled code from numba.None: Defaults to'cython'or globally settingcompute.use_numbaengine_kwargsdict, default NoneFor'cython'engine, there are no acceptedengine_kwargsFor'numba'engine, the engine can acceptnopython,nogilandparalleldictionary keys. The values must either beTrueorFalse. The defaultengine_kwargsfor the'numba'engine is{'nopython':True,'nogil':False,'parallel':False}and will be
applied to the function**kwargsIffuncis None,**kwargsare used to define the output names and
aggregations via Named Aggregation. Seefuncentry.Otherwise, keyword arguments to be passed into func.Returns:SeriesSee alsoSeries.groupby.applyApply function func group-wise and combine the results together.Series.groupby.transformTransforms the Series on each group based on the given function.Series.aggregateAggregate using one or more operations over the specified axis.NotesWhen usingengine='numba', there will be no “fall back” behavior internally.
The group data and group index will be passed as numpy arrays to the JITed
user defined function, and no alternative execution attempts will be tried.Functions that mutate the passed object can produce unexpected
behavior or errors and are not supported. SeeMutating with User Defined Function (UDF) methodsfor more details.Changed in version 1.3.0:The resulting dtype will reflect the return value of the passedfunc,
see the examples below.Examples>>>s=pd.Series([1,2,3,4])>>>s0    11    22    33    4dtype: int64>>>s.groupby([1,1,2,2]).min()1    12    3dtype: int64>>>s.groupby([1,1,2,2]).agg('min')1    12    3dtype: int64>>>s.groupby([1,1,2,2]).agg(['min','max'])min  max1    1    22    3    4The output column names can be controlled by passing
the desired column names and aggregations as keyword arguments.>>>s.groupby([1,1,2,2]).agg(...minimum='min',...maximum='max',...)minimum  maximum1        1        22        3        4Changed in version 1.3.0:The resulting dtype will reflect the return value of the aggregating function.>>>s.groupby([1,1,2,2]).agg(lambdax:x.astype(float).min())1    1.02    3.0dtype: float64"
